{
  "diagram_type": "sequence",
  "meta": {
    "title": "Imported sequence",
    "density": "teaching"
  },
  "participants": [
    {
      "id": "U",
      "label": "User"
    },
    {
      "id": "G",
      "label": "Gateway"
    },
    {
      "id": "A",
      "label": "Application"
    }
  ],
  "messages": [
    {
      "from": "U",
      "to": "G",
      "label": "Submit request",
      "variant": "default"
    },
    {
      "from": "G",
      "to": "A",
      "label": "Forward authorized request",
      "variant": "default"
    },
    {
      "from": "A",
      "to": "G",
      "label": "Return result",
      "variant": "return"
    },
    {
      "from": "G",
      "to": "U",
      "label": "Deliver response",
      "variant": "return"
    }
  ]
}
